<?xml version="1.0" encoding="UTF-8" ?>
<xs:schema xmlns:xs ="http://www.w3.org/2001/XMLSchema">
<xs:element name="account">
    <xs:complexType>
        <xs:sequence>
            <xs:element name="surname" type="xs:string"/>
            <xs:element name="name" type="xs:string"/>
            <xs:element name="patronymic" type="xs:string"/>
            <xs:element name="date_of_birth" type="xs:string"/>
            <xs:element name="country" type="xs:string"/>
            <xs:element name="city" type="xs:string"/>
            <xs:element name="telephone" type="xs:string"/>
            <xs:element name="email" type="xs:string"/>
        </xs:sequence>
    </xs:complexType>
</xs:element>
</xs:schema>