<?xml version="1.0" encoding="UTF-8"?>
<?xml-stylesheet type="text/css" href="style.css"?>

<account xmlns:xsi="http://www.w3.org/2001/XMLSchema-instance" xsi:noNamespaceSchemaLocation="3.xsd">
    <surname>Жук</surname>
    <name>Светлана</name>
    <patronymic>Сергеевна</patronymic>
    <date_of_birth>20.10.2004</date_of_birth>
    <country>Belarus</country>
    <city>Minsk</city>
    <telephone> +375259265072</telephone>
    <email>superpando4ka@gmail.com</email>
</account>